Priority,Type,Source,Target,Suggested Anchor,Suggested Location,Nearest Existing Sentence,Paste-Ready Sentence,Reason,Done
Medium,Underlinked page,/football-development/improve-football-decision-making,/parent-guides/futurefit-football-dna-interview-part-1,"FutureFit Explained: Football DNA on 3v3, More Touches and Youth Development",Paragraph 18,"England Football's FutureFit changes continue this philosophy by extending age-appropriate small-sided football for longer, giving young players more opportunities to stay involved, solve problems and make decisions.","This is covered in more detail in our guide on [futureFit Explained: Football DNA on 3v3, More Touches and Youth Development](/parent-guides/futurefit-football-dna-interview-part-1).","Only 2 total inbound link(s) (1 contextual) - weak content overlap, verify relevance manually",
Medium,Underlinked page,/academy-pathway/academy-categories-explained,/parent-guides/futurefit-football-dna-interview-part-1,"FutureFit Explained: Football DNA on 3v3, More Touches and Youth Development",Paragraph 5,"<div className=""rounded-xl border border-red-100 bg-white px-4 py-3""> <div className=""text-xs font-bold uppercase tracking-wide text-red-700""> Parent takeaway </div> <div className=""mt-1 font-semibold text-slate-900""> Highest opportunity, but usually the biggest commitment.","This is covered in more detail in our guide on [futureFit Explained: Football DNA on 3v3, More Touches and Youth Development](/parent-guides/futurefit-football-dna-interview-part-1).","Only 2 total inbound link(s) (1 contextual) - weak content overlap, verify relevance manually",
High,Overlinking (3+ mentions),/parent-guides/what-is-the-junior-premier-league,/parent-guides/jpl-and-academy-football,,,,,"Linked 3 times - remove the Related Articles entry for this link, then no strong alternative found - just cut back to 1-2 mentions",
High,Overlinking (3+ mentions),/parent-guides/what-is-the-junior-premier-league,/parent-guides/jpl-vs-grassroots-football,,,,,"Linked 3 times - remove the Related Articles entry for this link, then no strong alternative found - just cut back to 1-2 mentions",
High,Overlinking (3+ mentions),/parent-guides/jpl-vs-grassroots-football,/football-development/good-football-development-environment,Should My Child Leave Grassroots Football For An Academy?,Paragraph 52,## Which children suit each pathway?,This is covered in more detail in our guide on [should My Child Leave Grassroots Football For An Academy](/parent-guides/leave-grassroots-football-for-an-academy).,"Linked 3 times - remove the Related Articles entry for this link, then use the freed slot for ""Should My Child Leave Grassroots Football For An Academy?"" (relevance 2.23) instead",
High,Overlinking (3+ mentions),/parent-guides/are-football-development-centres-worth-it,/football-development/good-football-development-environment,What Is Grassroots Football?,"No paragraph has strong enough overlap with what this article actually covers - add manually where it fits, or reconsider whether this pairing belongs at all.",,You may want to link to our guide on [what Is Grassroots Football](/parent-guides/what-is-grassroots-football) somewhere relevant.,"Linked 3 times - remove the Related Articles entry for this link, then use the freed slot for pillar ""What Is Grassroots Football?"", which this page doesn't link to yet (also resolves a section 7 gap)",
Low,Overlinking (related-slot swap),/parent-guides/are-football-development-centres-worth-it,/academy-pathway/uk-football-development-centres-explained,Should My Child Leave Grassroots Football For An Academy?,Related Articles list,,"Replace the Related Articles entry for ""UK Football Development Centres Explained"" (/academy-pathway/uk-football-development-centres-explained) with [Should My Child Leave Grassroots Football For An Academy?](/parent-guides/leave-grassroots-football-for-an-academy).","Already linked contextually to ""UK Football Development Centres Explained"" (relevance 2.14) - ""Should My Child Leave Grassroots Football For An Academy?"" (relevance 2.24) is a better fit for the remaining related-articles slot",
High,Overlinking (3+ mentions),/football-development/how-much-training-is-too-much,/football-development/build-confidence-young-footballers,How To Improve Football Decision Making In Young Players,Paragraph 51,"Unstructured play - kickabouts in the park, street football, games in the garden - also develops creativity and decision making in ways that organised coaching often doesn't.",This is covered in more detail in our guide on [how To Improve Football Decision Making In Young Players](/football-development/improve-football-decision-making).,"Linked 3 times - remove the Related Articles entry for this link, then use the freed slot for ""How To Improve Football Decision Making In Young Players"" (relevance 2.07) instead",
High,Overlinking (3+ mentions),/football-development/good-football-development-environment,/football-development/build-confidence-young-footballers,,,,,"Linked 3 times - remove the Related Articles entry for this link, then no strong alternative found - just cut back to 1-2 mentions",
Low,Overlinking (related-slot swap),/football-development/good-football-development-environment,/football-development/signs-your-child-is-ready-for-academy-football,How To Improve Football Decision Making In Young Players,Related Articles list,,"Replace the Related Articles entry for ""Signs Your Child Is Ready for Academy Football"" (/football-development/signs-your-child-is-ready-for-academy-football) with [How To Improve Football Decision Making In Young Players](/football-development/improve-football-decision-making).","Already linked contextually to ""Signs Your Child Is Ready for Academy Football"" (relevance 1.86) - ""How To Improve Football Decision Making In Young Players"" (relevance 2.57) is a better fit for the remaining related-articles slot",
High,Overlinking (3+ mentions),/academy-trials/how-to-get-scouted-for-football,/academy-trials/what-do-academy-coaches-look-for,Football Academy Trials UK: How They Really Work,Paragraph 13,Scouting is usually a process rather than a single event.,This is covered in more detail in our guide on [football Academy Trials UK: How They Really Work](/academy-trials/football-academy-trials-uk).,"Linked 3 times - remove the Related Articles entry for this link, then use the freed slot for pillar ""Football Academy Trials UK: How They Really Work"", which this page doesn't link to yet (also resolves a section 7 gap)",
Low,Overlinking (related-slot swap),/academy-trials/how-to-get-scouted-for-football,/academy-trials/what-happens-at-academy-trials,How to Join a Football Academy: A Realistic Guide for Parents,Related Articles list,,"Replace the Related Articles entry for ""What Happens at Football Academy Trials"" (/academy-trials/what-happens-at-academy-trials) with [How to Join a Football Academy: A Realistic Guide for Parents](/academy-pathway/how-to-join-a-football-academy).","Already linked contextually to ""What Happens at Football Academy Trials"" (relevance 1.33) - ""How to Join a Football Academy: A Realistic Guide for Parents"" (relevance 3.45) is a better fit for the remaining related-articles slot",
Low,Overlinking (related-slot swap),/academy-trials/how-to-get-scouted-for-football,/academy-pathway/uk-football-development-centres-explained,How Football Scouts Identify Players,Related Articles list,,"Replace the Related Articles entry for ""UK Football Development Centres Explained"" (/academy-pathway/uk-football-development-centres-explained) with [How Football Scouts Identify Players](/academy-trials/how-football-scouts-identify-players).","Already linked contextually to ""UK Football Development Centres Explained"" (relevance 1.52) - ""How Football Scouts Identify Players"" (relevance 2.55) is a better fit for the remaining related-articles slot",
High,Overlinking (3+ mentions),/academy-trials/football-academy-trials-uk,/academy-trials/how-football-scouts-identify-players,How to Join a Football Academy: A Realistic Guide for Parents,Paragraph 26,- Grassroots football - Development centres - Scouting - School football - County football - Referrals from trusted coaches,This is covered in more detail in our guide on [how to Join a Football Academy: A Realistic Guide for Parents](/academy-pathway/how-to-join-a-football-academy).,"Linked 3 times - remove the Related Articles entry for this link, then use the freed slot for ""How to Join a Football Academy: A Realistic Guide for Parents"" (relevance 2.71) instead",
High,Overlinking (3+ mentions),/academy-trials/football-academy-trials-uk,/academy-trials/football-trials-near-me,Arsenal FC Development Centre: A Parent's Guide,Paragraph 48,"London contains one of the highest concentrations of professional academies in the country, including Arsenal, Chelsea, Crystal Palace, Fulham, Tottenham Hotspur, Brentford and West Ham United.",This is covered in more detail in our guide on [arsenal FC Development Centre: A Parent's Guide](/academy-pathway/arsenal-development-centre-guide).,"Linked 3 times - remove the mention in paragraph 107 (""The best starting point is to visit the official websites of professional clubs in your area. Clubs occasionally advertise recruitment opportunities, developmen""), then use the freed slot for ""Arsenal FC Development Centre: A Parent's Guide"" (relevance 2.3) instead",
High,Overlinking (3+ mentions),/academy-trials/football-academy-trials-uk,/parent-guides/are-football-development-centres-worth-it,Does the Junior Premier League Lead to Academy Football?,Paragraph 35,"If your child is playing regularly for a good junior team and performing consistently, they have a reasonable chance of being noticed by a scout over time.",This is covered in more detail in our guide on [does the Junior Premier League Lead to Academy Football](/parent-guides/jpl-and-academy-football).,"Linked 3 times - remove the Related Articles entry for this link, then use the freed slot for ""Does the Junior Premier League Lead to Academy Football?"" (relevance 2.07) instead",
Low,Overlinking (related-slot swap),/academy-trials/football-academy-trials-uk,/academy-pathway/development-centres-vs-academies,JPL Trials: How Do You Get Into the Junior Premier League?,Related Articles list,,"Replace the Related Articles entry for ""Development Centres vs Academies: What's the Difference?"" (/academy-pathway/development-centres-vs-academies) with [JPL Trials: How Do You Get Into the Junior Premier League?](/parent-guides/how-to-get-into-the-jpl).","Already linked contextually to ""Development Centres vs Academies: What's the Difference?"" (relevance 1.27) - ""JPL Trials: How Do You Get Into the Junior Premier League?"" (relevance 2.03) is a better fit for the remaining related-articles slot",
High,Overlinking (3+ mentions),/academy-pathway/what-is-eppp,/academy-pathway/how-academy-football-works,UK Football Development Centres Explained,"No paragraph has strong enough overlap with what this article actually covers - add manually where it fits, or reconsider whether this pairing belongs at all.",,You may want to link to our guide on [uK Football Development Centres Explained](/academy-pathway/uk-football-development-centres-explained) somewhere relevant.,"Linked 3 times - remove the Related Articles entry for this link, then use the freed slot for ""UK Football Development Centres Explained"" (relevance 2.05) instead",
Low,Overlinking (related-slot swap),/academy-pathway/what-is-eppp,/academy-pathway/can-academy-players-play-grassroots-football,Premier League Development Centres,Related Articles list,,"Replace the Related Articles entry for ""Can Academy Players Play Grassroots Football?"" (/academy-pathway/can-academy-players-play-grassroots-football) with [Premier League Development Centres](/academy-pathway/premier-league-development-centres-list).","Already linked contextually to ""Can Academy Players Play Grassroots Football?"" (relevance 1.61) - ""Premier League Development Centres"" (relevance 2.39) is a better fit for the remaining related-articles slot",
High,Overlinking (3+ mentions),/academy-pathway/what-age-do-football-academies-recruit,/academy-pathway/football-scholarships-uk,Development Centres vs Academies: What's the Difference?,Paragraph 3,"<div className=""rounded-2xl border border-slate-200 bg-slate-50 p-5""> <div className=""text-sm font-semibold text-slate-500 mb-1"">U9-U11</div> <h3 className=""text-lg font-bold text-gray-900"">Foundation Phase</h3> <div className=""mt-2 text-gray-700""> Initial academy recruitment and squad building.",This is covered in more detail in our guide on [development Centres vs Academies: What's the Difference](/academy-pathway/development-centres-vs-academies).,"Linked 3 times - remove the Related Articles entry for this link, then use the freed slot for pillar ""Development Centres vs Academies: What's the Difference?"", which this page doesn't link to yet (also resolves a section 7 gap)",
Low,Overlinking (related-slot swap),/academy-pathway/what-age-do-football-academies-recruit,/academy-trials/how-football-scouts-identify-players,How to Become a Professional Footballer: What Parents Should Actually Know,Related Articles list,,"Replace the Related Articles entry for ""How Football Scouts Identify Players"" (/academy-trials/how-football-scouts-identify-players) with [How to Become a Professional Footballer: What Parents Should Actually Know](/football-development/how-to-become-a-professional-footballer).","Already linked contextually to ""How Football Scouts Identify Players"" (relevance 1.73) - ""How to Become a Professional Footballer: What Parents Should Actually Know"" (relevance 2.3) is a better fit for the remaining related-articles slot",
High,Overlinking (3+ mentions),/academy-pathway/uk-football-development-centres-explained,/academy-pathway/development-centres-vs-academies,How to Join a Football Academy: A Realistic Guide for Parents,Paragraph 82,"Many development centres accept applications from any child within the relevant age group, while others require an invitation, assessment or recommendation from a coach.",This is covered in more detail in our guide on [how to Join a Football Academy: A Realistic Guide for Parents](/academy-pathway/how-to-join-a-football-academy).,"Linked 3 times - remove the Related Articles entry for this link, then use the freed slot for ""How to Join a Football Academy: A Realistic Guide for Parents"" (relevance 2.52) instead",
High,Overlinking (3+ mentions),/academy-pathway/uk-football-development-centres-explained,/academy-pathway/how-players-progress-through-football-development-centres,Arsenal FC Development Centre: A Parent's Guide,Paragraph 41,"**Location** Larger clubs may run satellite development centres across a region, allowing players to attend a site closer to home.",This is covered in more detail in our guide on [arsenal FC Development Centre: A Parent's Guide](/academy-pathway/arsenal-development-centre-guide).,"Linked 3 times - remove the Related Articles entry for this link, then use the freed slot for ""Arsenal FC Development Centre: A Parent's Guide"" (relevance 2.26) instead",
High,Overlinking (3+ mentions),/academy-pathway/how-to-join-a-football-academy,/academy-pathway/development-centres-vs-academies,"Category 1, 2, 3 and 4 Football Academies Explained",Paragraph 33,"- Some lower-category academies and development programmes run trial events for specific age groups - Clubs may invite a player for an observation session or series of training sessions after a scout has already identified them - At the scholarship phase (Under-16 to Under-18), some clubs run more structured processes","This is covered in more detail in our guide on [category 1, 2, 3 and 4 Football Academies Explained](/academy-pathway/academy-categories-explained).","Linked 3 times - remove the Related Articles entry for this link, then use the freed slot for pillar ""Category 1, 2, 3 and 4 Football Academies Explained"", which this page doesn't link to yet (also resolves a section 7 gap)",
Low,Overlinking (related-slot swap),/academy-pathway/how-to-join-a-football-academy,/academy-pathway/what-age-do-football-academies-recruit,How to Get Scouted for Football,Related Articles list,,"Replace the Related Articles entry for ""What Age Do Football Academies Recruit?"" (/academy-pathway/what-age-do-football-academies-recruit) with [How to Get Scouted for Football](/academy-trials/how-to-get-scouted-for-football).","Already linked contextually to ""What Age Do Football Academies Recruit?"" (relevance 1.89) - ""How to Get Scouted for Football"" (relevance 3.45) is a better fit for the remaining related-articles slot",
Low,Overlinking (related-slot swap),/academy-pathway/how-to-join-a-football-academy,/academy-trials/what-happens-at-academy-trials,Football Academy Trials UK: How They Really Work,Related Articles list,,"Replace the Related Articles entry for ""What Happens at Football Academy Trials"" (/academy-trials/what-happens-at-academy-trials) with [Football Academy Trials UK: How They Really Work](/academy-trials/football-academy-trials-uk).","Already linked contextually to ""What Happens at Football Academy Trials"" (relevance 0.85) - ""Football Academy Trials UK: How They Really Work"" (relevance 2.71) is a better fit for the remaining related-articles slot",
Low,Overlinking (related-slot swap),/academy-pathway/how-to-join-a-football-academy,/academy-trials/how-football-clubs-recruit-young-players,Football Trials Near Me: A Realistic Parent's Guide to Academy Recruitment in the UK,Related Articles list,,"Replace the Related Articles entry for ""How Football Clubs Recruit Young Players"" (/academy-trials/how-football-clubs-recruit-young-players) with [Football Trials Near Me: A Realistic Parent's Guide to Academy Recruitment in the UK](/academy-trials/football-trials-near-me).","Already linked contextually to ""How Football Clubs Recruit Young Players"" (relevance 2.18) - ""Football Trials Near Me: A Realistic Parent's Guide to Academy Recruitment in the UK"" (relevance 2.57) is a better fit for the remaining related-articles slot",
High,Overlinking (3+ mentions),/academy-pathway/how-academy-football-works,/academy-pathway/understanding-academy-release,How to Become a Professional Footballer: What Parents Should Actually Know,Paragraph 13,"<div> <h3 className=""text-2xl font-bold text-gray-900 mb-4""> Foundation Phase </h3>",This is covered in more detail in our guide on [how to Become a Professional Footballer: What Parents Should Actually Know](/football-development/how-to-become-a-professional-footballer).,"Linked 3 times - remove the Related Articles entry for this link, then use the freed slot for ""How to Become a Professional Footballer: What Parents Should Actually Know"" (relevance 2.23) instead",
Low,Overlinking (related-slot swap),/academy-pathway/how-academy-football-works,/academy-pathway/football-scholarships-uk,Development Centres vs Academies: What's the Difference?,Related Articles list,,"Replace the Related Articles entry for ""Football Scholarships UK: What Parents Need to Know"" (/academy-pathway/football-scholarships-uk) with [Development Centres vs Academies: What's the Difference?](/academy-pathway/development-centres-vs-academies).","Already linked contextually to ""Football Scholarships UK: What Parents Need to Know"" (relevance 1.61) - ""Development Centres vs Academies: What's the Difference?"" (relevance 2.16) is a better fit for the remaining related-articles slot",
High,Overlinking (3+ mentions),/academy-pathway/football-development-centres-near-me,/academy-pathway/uk-football-development-centres-explained,How Academy Football Works in the UK,Paragraph 92,Development centres generally have fewer geographical restrictions than formal academy registration.,This is covered in more detail in our guide on [how Academy Football Works in the UK](/academy-pathway/how-academy-football-works).,"Linked 4 times - remove the Related Articles entry for this link, then use the freed slot for pillar ""How Academy Football Works in the UK"", which this page doesn't link to yet (also resolves a section 7 gap)",
High,Overlinking (3+ mentions),/academy-pathway/arsenal-development-centre-guide,/academy-pathway/football-development-centres-in-london,How Academy Football Works in the UK,"No paragraph has strong enough overlap with what this article actually covers - add manually where it fits, or reconsider whether this pairing belongs at all.",,You may want to link to our guide on [how Academy Football Works in the UK](/academy-pathway/how-academy-football-works) somewhere relevant.,"Linked 3 times - remove the Related Articles entry for this link, then use the freed slot for pillar ""How Academy Football Works in the UK"", which this page doesn't link to yet (also resolves a section 7 gap)",
Low,Overlinking (related-slot swap),/academy-pathway/arsenal-development-centre-guide,/academy-pathway/uk-football-development-centres-explained,Premier League Development Centres,Related Articles list,,"Replace the Related Articles entry for ""UK Football Development Centres Explained"" (/academy-pathway/uk-football-development-centres-explained) with [Premier League Development Centres](/academy-pathway/premier-league-development-centres-list).","Already linked contextually to ""UK Football Development Centres Explained"" (relevance 2.26) - ""Premier League Development Centres"" (relevance 3.24) is a better fit for the remaining related-articles slot",
Low,Overlinking (related-slot swap),/academy-pathway/arsenal-development-centre-guide,/academy-trials/football-academy-trials-uk,West Ham United Development Centre: A Parent's Guide,Related Articles list,,"Replace the Related Articles entry for ""Football Academy Trials UK: How They Really Work"" (/academy-trials/football-academy-trials-uk) with [West Ham United Development Centre: A Parent's Guide](/academy-pathway/west-ham-player-pathway-guide).","Already linked contextually to ""Football Academy Trials UK: How They Really Work"" (relevance 2.3) - ""West Ham United Development Centre: A Parent's Guide"" (relevance 2.38) is a better fit for the remaining related-articles slot",
Low,Overlinking (related-slot swap),/academy-trials/how-football-clubs-recruit-young-players,/academy-trials/how-football-scouts-identify-players,Football Trials Near Me: A Realistic Parent's Guide to Academy Recruitment in the UK,Related Articles list,,"Replace the Related Articles entry for ""How Football Scouts Identify Players"" (/academy-trials/how-football-scouts-identify-players) with [Football Trials Near Me: A Realistic Parent's Guide to Academy Recruitment in the UK](/academy-trials/football-trials-near-me).","Already linked contextually to ""How Football Scouts Identify Players"" (relevance 2.6) - ""Football Trials Near Me: A Realistic Parent's Guide to Academy Recruitment in the UK"" (relevance 2.64) is a better fit for the remaining related-articles slot",
Low,Overlinking (related-slot swap),/academy-trials/how-football-clubs-recruit-young-players,/academy-pathway/uk-football-development-centres-explained,How to Join a Football Academy: A Realistic Guide for Parents,Related Articles list,,"Replace the Related Articles entry for ""UK Football Development Centres Explained"" (/academy-pathway/uk-football-development-centres-explained) with [How to Join a Football Academy: A Realistic Guide for Parents](/academy-pathway/how-to-join-a-football-academy).","Already linked contextually to ""UK Football Development Centres Explained"" (relevance 1.23) - ""How to Join a Football Academy: A Realistic Guide for Parents"" (relevance 2.18) is a better fit for the remaining related-articles slot",
Low,Overlinking (related-slot swap),/academy-trials/how-football-clubs-recruit-young-players,/academy-trials/what-happens-at-academy-trials,Does the Junior Premier League Lead to Academy Football?,Related Articles list,,"Replace the Related Articles entry for ""What Happens at Football Academy Trials"" (/academy-trials/what-happens-at-academy-trials) with [Does the Junior Premier League Lead to Academy Football?](/parent-guides/jpl-and-academy-football).","Already linked contextually to ""What Happens at Football Academy Trials"" (relevance 1.03) - ""Does the Junior Premier League Lead to Academy Football?"" (relevance 2) is a better fit for the remaining related-articles slot",
Low,Overlinking (related-slot swap),/parent-guides/leave-grassroots-football-for-an-academy,/academy-pathway/development-centres-vs-academies,Are Football Development Centres Worth It?,Related Articles list,,"Replace the Related Articles entry for ""Development Centres vs Academies: What's the Difference?"" (/academy-pathway/development-centres-vs-academies) with [Are Football Development Centres Worth It?](/parent-guides/are-football-development-centres-worth-it).","Already linked contextually to ""Development Centres vs Academies: What's the Difference?"" (relevance 1.48) - ""Are Football Development Centres Worth It?"" (relevance 2.24) is a better fit for the remaining related-articles slot",
Low,Overlinking (related-slot swap),/parent-guides/leave-grassroots-football-for-an-academy,/academy-pathway/can-academy-players-play-grassroots-football,JPL vs Grassroots Football: Which Is Right for Your Child?,Related Articles list,,"Replace the Related Articles entry for ""Can Academy Players Play Grassroots Football?"" (/academy-pathway/can-academy-players-play-grassroots-football) with [JPL vs Grassroots Football: Which Is Right for Your Child?](/parent-guides/jpl-vs-grassroots-football).","Already linked contextually to ""Can Academy Players Play Grassroots Football?"" (relevance 1.45) - ""JPL vs Grassroots Football: Which Is Right for Your Child?"" (relevance 2.23) is a better fit for the remaining related-articles slot",
